{
  "manifest_schema_id": "rcc002.reproduction-manifest",
  "manifest_schema_version": "1.0.0",
  "manifest_schema_ref": "rcc002.reproduction-manifest/1.0.0",
  "manifest_type": "reproduction",
  "manifest_id": "manifest:sha256:0000000000000000000000000000000000000000000000000000000000000000",
  "created_at_utc": "2026-07-30T12:00:00Z",
  "producer": {
    "component": "rcc002-fixture-builder",
    "version": "1.0.0"
  },
  "project": "RCC-002",
  "status": "final",
  "subject_dataset_manifest_id": "manifest:sha256:0000000000000000000000000000000000000000000000000000000000000000",
  "subject_dataset_manifest_byte_sha256": "0000000000000000000000000000000000000000000000000000000000000000",
  "source_run_id": "run:source",
  "source_build_id": "build:sha256:0000000000000000000000000000000000000000000000000000000000000000",
  "target_run_id": "run:target",
  "target_build_id": "build:sha256:0000000000000000000000000000000000000000000000000000000000000000",
  "source_environment": {
    "profile_id": "env-v2",
    "canonical_sha256": "0000000000000000000000000000000000000000000000000000000000000000"
  },
  "target_environment": {
    "profile_id": "env-v2",
    "canonical_sha256": "0000000000000000000000000000000000000000000000000000000000000000"
  },
  "environment_differences": [],
  "artifact_comparisons": [
    {
      "logical_name": "audit-v2",
      "byte_equal": true,
      "semantic_equal": true,
      "within_registered_tolerance": true,
      "classification_equal": true
    }
  ],
  "comparison_report_relative_path": "reports/reproduction.json",
  "equality_result": "E3",
  "deviations": [],
  "final_status": "PASS"
}
